priority,owner,gate,action,trigger,artifact,proof_to_close,blocked_by
1,Independent workflow,meshsafe_huygens_physics,"Export matched local E/H CSVs and far-field references from the completed short x 96-point E/H pilot, then evaluate the frozen eh_love_equivalence_minus_j96 Huygens rule without retuning before expanding to the remaining source-family cases.","The short x solver-safe pilot now has completed full local E-field and H-field artifacts; the active gate is no longer runtime repair, but matched export and frozen-rule verification.",data/cst_meshsafe_huygens_source_family_workpack/next_source_family_commands.csv and data/cst_exports/level1_meshsafe_huygens_source_family/*_local_[eh]field.csv,"Six automation-ready source-family rows have matched local E/H exports, far-field references, and the same frozen Huygens rule remains accepted without retuning.",
2,CST operator,true_monitor,"Use outputs\cst_true_nearfield_handoff\expected_true_monitor_files.csv, then export authoritative full-grid CST true near-field monitor CSVs for the queued Level 1 cases.",G3 dashboard status is pending_source.,data/cst_exports/level1_true_nearfield/<sample>_true_nearfield.csv,python code\run_true_nearfield_gate.py reports no pending_source rows for full_grid_162.,CST monitor CSVs
3,Algorithm operator,post_true_monitor,"After full-grid monitor CSVs exist, derive queued 32/120 layouts and compare them against the FarfieldPlot-derived reference.",full_grid_162 true-monitor CSV exists for each required sample.,data/cst_true_nearfield_workpack/comparison/,"true_nearfield_gate_summary.json reports reference_match or needs_physical_rerun with comparison metrics, not pending_source.",Full-grid monitor CSVs
4,Algorithm operator,physical_baseline,"Rerun source-model, convention, scalar SWE, reduced-layout, and Huygens baselines on true-monitor input if the gate reports needs_physical_rerun.",true-monitor comparison differs materially from the current FarfieldPlot-derived table.,Updated data/sampling_layouts/* result directories and this dashboard.,A full-grid physical baseline reaches strict_pass or an approved near-pass before reduced-layout claims are written.,True-monitor gate comparison result
5,Report/PPT operator,wording,"Use center-source and scalar SWE rows as sanity evidence; keep generic, sparse, and Huygens rows as diagnostic bottleneck evidence.","Preparing report, PPT, or mentor update.",docs/progress_reports/latest_mentor_brief.md or final report text.,Reduced-layout claims explicitly say 'priority for true-monitor rerun' until a physical full-grid baseline passes.,
